8887_281472_000055_000000	Rodney Grant did not strike out, but, nevertheless, he failed to meet one of Hooker's shoots squarely, and the grammar school shortstop gathered in an easy grounder and threw to first for the third put-out.	Rodney Grant did not strike out, but, nevertheless, he failed to meet one of Hooker's shoots squarely, and the grammar school shortstop gathered in an easy grounder and threw to first for the third put out.	true	660.32	672.64	22.328325
8887_281472_000056_000000	Roger Eliot lingered to speak a word to Hooker, and Springer, still unnoticed, plainly heard what he said.	Roger Eliot lingered to speak a word to Hooker, and Springer, still unnoticed, plainly heard what he said.	true	673.34	680.41	22.268078
8887_281472_000057_000000	"Perhaps we've made a mistake in sizing you up, Roy, old fellow.	"Perhaps we've made a mistake in sizing you up, Roy, old fellow.	true	681.08	685.21	23.803314
8887_281472_000057_000001	It's your work alone that has prevented us from scoring in either of these innings.	It's your work alone that has prevented us from scoring in either of these innings.	true	685.37	689.74	22
8887_281472_000057_000002	You've always had speed and curves, but now you seem able to get the pill over.	You've always had speed and curves, but now you seem able to get the pill over.	true	689.87	695.08	22.894281
8887_281472_000057_000003	Keep it up, old fellow, and you'll make a pitcher yet, We may need you before the season ends."	Keep it up, old fellow, and you'll make a pitcher yet, We may need you before the season ends."	false	695.36	709.59	19.093786
